ai_server/tunableop_results0.csv
Validator,PT_VERSION,2.12.0
GemmAndBiasTunableOp_float_TN,tn_1152_2688_384_ld_384_384_1152,Default,0.156517
GemmAndBiasTunableOp_float_TN,tn_384_2688_384_ld_384_384_384,Default,0.0631043
GemmAndBiasTunableOp_float_TN,tn_1536_2688_384_ld_384_384_1536,Default,0.203407
GemmAndBiasTunableOp_float_TN,tn_384_2688_1536_ld_1536_1536_384,Default,0.231578
GemmAndBiasTunableOp_float_TN,tn_1152_1344_384_ld_384_384_1152,Default,0.0902365
GemmAndBiasTunableOp_float_TN,tn_384_1344_384_ld_384_384_384,Default,0.0548176
GemmAndBiasTunableOp_float_TN,tn_1536_1344_384_ld_384_384_1536,Default,0.108335
GemmAndBiasTunableOp_float_TN,tn_384_1344_1536_ld_1536_1536_384,Default,0.130841
GemmAndBiasTunableOp_float_TN,tn_768_1344_384_ld_384_384_768,Default,0.0639091
GemmAndBiasTunableOp_float_TN,tn_768_2688_384_ld_384_384_768,Default,0.107902
GemmTunableOp_float_NN,nn_512_32_1_ld_512_1_512,Default,0.0073504
GemmTunableOp_float_TN,tn_16_2048_2048_ld_2048_2048_16,Default,0.0502317
GemmTunableOp_float_TN,tn_2048_2048_16_ld_16_16_2048,Default,0.0276627
GemmTunableOp_float_TN,tn_512_2048_16_ld_16_16_512,Default,0.00879456
GemmStridedBatchedTunableOp_float_TN,tn_512_512_64_B_128_ld_64_64_512,Default,0.355237
GemmStridedBatchedTunableOp_float_NN,nn_64_512_512_B_128_ld_64_512_64,Default,0.308642
GemmTunableOp_float_TN,tn_2048_2048_2_ld_2_2_2048,Default,0.0449261
GemmTunableOp_float_TN,tn_8192_2048_2_ld_2_2_8192,Default,0.238395
GemmTunableOp_float_TN,tn_2048_2048_4_ld_4_4_2048,Default,0.0412394
GemmTunableOp_float_TN,tn_8192_2048_4_ld_4_4_8192,Default,0.246702
GemmTunableOp_float_NN,nn_2048_2048_1_ld_1_1_2048,Default,0.0348701
GemmTunableOp_float_NN,nn_512_2048_1_ld_1_1_512,Default,0.00837632
GemmTunableOp_float_TN,tn_8192_2048_3_ld_3_3_8192,Default,0.237321
GemmTunableOp_float_TN,tn_512_2048_4_ld_4_4_512,Default,0.0141085
GemmTunableOp_float_TN,tn_512_2048_2_ld_2_2_512,Default,0.014168
GemmTunableOp_float_TN,tn_2048_2048_8_ld_8_8_2048,Default,0.0391562
GemmTunableOp_float_TN,tn_512_2048_8_ld_8_8_512,Default,0.0146528
GemmTunableOp_float_TN,tn_2048_2048_9_ld_9_9_2048,Default,0.0442646
GemmTunableOp_float_TN,tn_512_2048_9_ld_9_9_512,Default,0.0141882
GemmTunableOp_float_TN,tn_2048_2048_30_ld_30_30_2048,Default,0.0479165
GemmTunableOp_float_TN,tn_183286_2048_2048_ld_2048_2048_183286,Default,76.3382
GemmTunableOp_float_NN,nn_2048_2048_183286_ld_2048_183286_2048,Default,61.1522
GemmTunableOp_float_NN,nn_8192_2048_2048_ld_8192_2048_8192,Default,2.94659
GemmTunableOp_float_NN,nn_2048_2048_8192_ld_2048_8192_2048,Default,2.88577
GemmTunableOp_float_NN,nn_2048_2048_2048_ld_2048_2048_2048,Default,0.742365
GemmStridedBatchedTunableOp_float_NT,nt_64_512_512_B_128_ld_64_512_64,Default,0.279258
GemmStridedBatchedTunableOp_float_NT,nt_512_64_512_B_128_ld_512_64_512,Default,0.309338
GemmTunableOp_float_NT,nt_16_512_2048_ld_16_512_16,Default,0.0166998
GemmTunableOp_float_NN,nn_16_2048_512_ld_16_512_16,Default,0.0188867
GemmTunableOp_float_NT,nt_2048_16_2048_ld_2048_16_2048,Default,0.0351405
GemmTunableOp_float_NN,nn_2048_2048_16_ld_2048_16_2048,Default,0.0258819
GemmTunableOp_float_NN,nn_2048_2048_512_ld_2048_512_2048,Default,0.21733
GemmTunableOp_float_NT,nt_16_2048_2048_ld_16_2048_16,Default,0.0328454
GemmTunableOp_float_NN,nn_16_2048_2048_ld_16_2048_16,Default,0.0464835
GemmTunableOp_float_TN,tn_2048_2048_7_ld_7_7_2048,Default,0.0442883
GemmTunableOp_float_TN,tn_512_2048_7_ld_7_7_512,Default,0.0145622
GemmTunableOp_float_TN,tn_2048_2048_12_ld_12_12_2048,Default,0.0392557
GemmTunableOp_float_TN,tn_512_2048_12_ld_12_12_512,Default,0.0147053
GemmTunableOp_float_TN,tn_2048_2048_15_ld_15_15_2048,Default,0.0447219
GemmTunableOp_float_TN,tn_512_2048_15_ld_15_15_512,Default,0.00967648
GemmTunableOp_float_TN,tn_2048_2048_11_ld_11_11_2048,Default,0.0423155
GemmTunableOp_float_TN,tn_512_2048_11_ld_11_11_512,Default,0.0143005
GemmTunableOp_float_TN,tn_2048_2048_27_ld_27_27_2048,Default,0.049817
GemmTunableOp_float_TN,tn_2048_2048_3_ld_3_3_2048,Default,0.0379226
GemmTunableOp_float_TN,tn_512_2048_3_ld_3_3_512,Default,0.0140877
GemmTunableOp_float_TN,tn_2048_2048_10_ld_10_10_2048,Default,0.0430211
GemmTunableOp_float_TN,tn_512_2048_10_ld_10_10_512,Default,0.0139824
GemmTunableOp_float_TN,tn_2048_2048_18_ld_18_18_2048,Default,0.0445533
GemmTunableOp_float_TN,tn_512_2048_18_ld_18_18_512,Default,0.0118042
GemmTunableOp_float_TN,tn_2048_2048_6_ld_6_6_2048,Default,0.040495
GemmTunableOp_float_TN,tn_512_2048_6_ld_6_6_512,Default,0.0145197
GemmTunableOp_float_TN,tn_2048_2048_24_ld_24_24_2048,Default,0.0480224
GemmTunableOp_float_TN,tn_2048_2048_17_ld_17_17_2048,Default,0.0412054
GemmTunableOp_float_TN,tn_512_2048_17_ld_17_17_512,Default,0.0108499
GemmTunableOp_float_TN,tn_2048_2048_14_ld_14_14_2048,Default,0.0498822
GemmTunableOp_float_TN,tn_512_2048_14_ld_14_14_512,Default,0.0136378
GemmTunableOp_float_TN,tn_2048_2048_26_ld_26_26_2048,Default,0.0549389
GemmTunableOp_float_TN,tn_2048_2048_13_ld_13_13_2048,Default,0.0427984
GemmTunableOp_float_TN,tn_512_2048_13_ld_13_13_512,Default,0.0104886
GemmTunableOp_float_TN,tn_2048_2048_20_ld_20_20_2048,Default,0.0441491
GemmTunableOp_float_TN,tn_512_2048_20_ld_20_20_512,Default,0.0115261
GemmTunableOp_float_TN,tn_2048_2048_28_ld_28_28_2048,Default,0.0508269
GemmTunableOp_float_TN,tn_2048_2048_25_ld_25_25_2048,Default,0.0408787
GemmTunableOp_float_TN,tn_2048_2048_5_ld_5_5_2048,Default,0.0433885
GemmTunableOp_float_TN,tn_512_2048_5_ld_5_5_512,Default,0.0142522
GemmTunableOp_float_TN,tn_2048_2048_29_ld_29_29_2048,Default,0.0477146
GemmTunableOp_float_TN,tn_2048_2048_31_ld_31_31_2048,Default,0.0516166
GemmTunableOp_float_TN,tn_2048_2048_33_ld_33_33_2048,Default,0.0582922
GemmTunableOp_float_TN,tn_2048_2048_32_ld_32_32_2048,Default,0.0472454
GemmTunableOp_float_TN,tn_2048_2048_19_ld_19_19_2048,Default,0.0535978
GemmTunableOp_float_TN,tn_512_2048_19_ld_19_19_512,Default,0.0153376
GemmTunableOp_float_TN,tn_2048_2048_23_ld_23_23_2048,Default,0.049304
GemmTunableOp_float_TN,tn_2048_2048_22_ld_22_22_2048,Default,0.0504685
GemmTunableOp_float_TN,tn_16_1024_2048_ld_2048_2048_16,Default,0.0297078
GemmTunableOp_float_TN,tn_2048_1024_16_ld_16_16_2048,Default,0.0165338
GemmTunableOp_float_TN,tn_512_1024_16_ld_16_16_512,Default,0.00837376
GemmStridedBatchedTunableOp_float_TN,tn_512_512_64_B_64_ld_64_64_512,Default,0.189296
GemmStridedBatchedTunableOp_float_NN,nn_64_512_512_B_64_ld_64_512_64,Default,0.16114
GemmTunableOp_float_TN,tn_2048_1024_2_ld_2_2_2048,Default,0.0206592
GemmTunableOp_float_TN,tn_8192_1024_2_ld_2_2_8192,Default,0.0655626
GemmTunableOp_float_TN,tn_2048_1024_4_ld_4_4_2048,Default,0.020703
GemmTunableOp_float_TN,tn_8192_1024_4_ld_4_4_8192,Default,0.038569
GemmTunableOp_float_NN,nn_2048_1024_1_ld_1_1_2048,Default,0.0135117
GemmTunableOp_float_NN,nn_512_1024_1_ld_1_1_512,Default,0.00629184
GemmTunableOp_float_TN,tn_512_1024_2_ld_2_2_512,Default,0.00765504
GemmTunableOp_float_TN,tn_8192_1024_3_ld_3_3_8192,Default,0.0652883
GemmTunableOp_float_TN,tn_2048_1024_3_ld_3_3_2048,Default,0.020568
GemmTunableOp_float_TN,tn_512_1024_3_ld_3_3_512,Default,0.00845696
GemmTunableOp_float_TN,tn_2048_1024_10_ld_10_10_2048,Default,0.0214378
GemmTunableOp_float_TN,tn_512_1024_10_ld_10_10_512,Default,0.0090368
GemmTunableOp_float_TN,tn_2048_1024_6_ld_6_6_2048,Default,0.0210448
GemmTunableOp_float_TN,tn_512_1024_6_ld_6_6_512,Default,0.00885728
GemmTunableOp_float_TN,tn_2048_1024_5_ld_5_5_2048,Default,0.0206755
GemmTunableOp_float_TN,tn_512_1024_5_ld_5_5_512,Default,0.00868544
GemmTunableOp_float_TN,tn_2048_1024_11_ld_11_11_2048,Default,0.0154845
GemmTunableOp_float_TN,tn_512_1024_11_ld_11_11_512,Default,0.00905952
GemmTunableOp_float_TN,tn_2048_1024_9_ld_9_9_2048,Default,0.021513
GemmTunableOp_float_TN,tn_512_1024_9_ld_9_9_512,Default,0.00900096
GemmTunableOp_float_TN,tn_2048_1024_24_ld_24_24_2048,Default,0.0174112
GemmTunableOp_float_TN,tn_183286_1024_2048_ld_2048_2048_183286,Default,37.9208
GemmTunableOp_float_NN,nn_2048_1024_183286_ld_2048_183286_2048,Default,31.1265
GemmTunableOp_float_NN,nn_8192_1024_2048_ld_8192_2048_8192,Default,1.50367
GemmTunableOp_float_NN,nn_2048_1024_8192_ld_2048_8192_2048,Default,1.38298
GemmTunableOp_float_NN,nn_2048_1024_2048_ld_2048_2048_2048,Default,0.374317
GemmStridedBatchedTunableOp_float_NT,nt_64_512_512_B_64_ld_64_512_64,Default,0.142588
GemmStridedBatchedTunableOp_float_NT,nt_512_64_512_B_64_ld_512_64_512,Default,0.162695
GemmTunableOp_float_NT,nt_16_512_1024_ld_16_512_16,Default,0.00964128
GemmTunableOp_float_NN,nn_16_1024_512_ld_16_512_16,Default,0.0141229
GemmTunableOp_float_NT,nt_2048_16_1024_ld_2048_16_2048,Default,0.0223558
GemmTunableOp_float_NN,nn_2048_1024_16_ld_2048_16_2048,Default,0.0145661
GemmTunableOp_float_NN,nn_2048_1024_512_ld_2048_512_2048,Default,0.123163
GemmTunableOp_float_NT,nt_16_2048_1024_ld_16_2048_16,Default,0.0236326
GemmTunableOp_float_NN,nn_16_1024_2048_ld_16_2048_16,Default,0.0269229
GemmTunableOp_float_TN,tn_2048_1024_13_ld_13_13_2048,Default,0.0156611
GemmTunableOp_float_TN,tn_512_1024_13_ld_13_13_512,Default,0.0103638
GemmTunableOp_float_TN,tn_2048_1024_8_ld_8_8_2048,Default,0.0210195
GemmTunableOp_float_TN,tn_512_1024_8_ld_8_8_512,Default,0.00876768
GemmTunableOp_float_TN,tn_2048_1024_25_ld_25_25_2048,Default,0.0224672
GemmTunableOp_float_TN,tn_2048_1024_7_ld_7_7_2048,Default,0.0211622
GemmTunableOp_float_TN,tn_512_1024_7_ld_7_7_512,Default,0.00890912
GemmTunableOp_float_TN,tn_2048_1024_23_ld_23_23_2048,Default,0.02188
GemmTunableOp_float_NN,nn_6_32_1_ld_6_1_6,Default,0.0064592
GemmTunableOp_float_TN,tn_16_6_2048_ld_2048_2048_16,Default,0.0171709
GemmTunableOp_float_TN,tn_2048_6_16_ld_16_16_2048,Default,0.00631104
GemmTunableOp_float_TN,tn_512_6_16_ld_16_16_512,Default,0.00596
GemmTunableOp_BFloat16_TN,tn_2048_6_4_ld_4_4_2048,Default,0.0061072
GemmTunableOp_BFloat16_TN,tn_8192_6_3_ld_3_3_8192,Default,0.0133395
GemmTunableOp_BFloat16_TN,tn_2048_6_5_ld_5_5_2048,Default,0.0077824
GemmTunableOp_BFloat16_TN,tn_8192_6_5_ld_5_5_8192,Default,0.0121149
GemmTunableOp_BFloat16_NN,nn_2048_6_1_ld_1_1_2048,Default,0.00820928
GemmTunableOp_BFloat16_NN,nn_512_6_1_ld_1_1_512,Default,0.00598208
GemmTunableOp_BFloat16_TN,tn_8192_6_4_ld_4_4_8192,Default,0.0066912
GemmTunableOp_BFloat16_TN,tn_2048_6_2_ld_2_2_2048,Default,0.0061792
GemmTunableOp_BFloat16_TN,tn_512_6_2_ld_2_2_512,Default,0.0060624
GemmTunableOp_BFloat16_TN,tn_2048_6_13_ld_13_13_2048,Default,0.00722048
GemmTunableOp_BFloat16_TN,tn_183286_1_2048_ld_2048_2048_183286,Default,1.18673
GemmTunableOp_float_TN,tn_32_1_1_ld_1_1_1,Default,0.00648416
GemmTunableOp_float_TN,tn_16_1_2048_ld_2048_2048_16,Default,0.0076752
GemmTunableOp_float_TN,tn_2048_1_16_ld_16_16_2048,Default,0.00769248
GemmTunableOp_float_TN,tn_512_1_16_ld_16_16_512,Default,0.00648224
GemmTunableOp_BFloat16_NN,nn_2048_1_1_ld_1_1_2048,Default,0.00598592
GemmTunableOp_BFloat16_NN,nn_512_1_1_ld_1_1_512,Default,0.00591648
GemmAndBiasTunableOp_BFloat16_TN,tn_2048_1_3_ld_3_3_2048,Default,0.00612704
GemmTunableOp_BFloat16_NN,nn_8192_1_1_ld_1_1_8192,Default,0.00659104
GemmAndBiasTunableOp_BFloat16_TN,tn_2048_1_2_ld_2_2_2048,Default,0.00560256
GemmAndBiasTunableOp_BFloat16_TN,tn_512_1_2_ld_2_2_512,Default,0.00565024
GemmAndBiasTunableOp_BFloat16_TN,tn_2048_1_20_ld_20_20_2048,Default,0.0066112
GemmAndBiasTunableOp_BFloat16_TN,tn_2048_1_4_ld_4_4_2048,Default,0.00620672
GemmAndBiasTunableOp_BFloat16_TN,tn_2048_1_11_ld_11_11_2048,Default,0.0063392
GemmAndBiasTunableOp_BFloat16_TN,tn_2048_1_9_ld_9_9_2048,Default,0.0081808
GemmAndBiasTunableOp_BFloat16_TN,tn_2048_1_8_ld_8_8_2048,Default,0.00645728
GemmAndBiasTunableOp_BFloat16_TN,tn_2048_1_7_ld_7_7_2048,Default,0.00554272
GemmAndBiasTunableOp_BFloat16_TN,tn_2048_1_6_ld_6_6_2048,Default,0.00639872
GemmAndBiasTunableOp_BFloat16_TN,tn_2048_1_5_ld_5_5_2048,Default,0.0063856
GemmAndBiasTunableOp_BFloat16_TN,tn_2048_1_23_ld_23_23_2048,Default,0.008536
GemmAndBiasTunableOp_BFloat16_TN,tn_2048_1_15_ld_15_15_2048,Default,0.0084064
GemmAndBiasTunableOp_BFloat16_TN,tn_2048_1_10_ld_10_10_2048,Default,0.00847392
GemmAndBiasTunableOp_BFloat16_TN,tn_512_1_3_ld_3_3_512,Default,0.00815584
GemmAndBiasTunableOp_BFloat16_TN,tn_512_1_4_ld_4_4_512,Default,0.00854112
GemmAndBiasTunableOp_BFloat16_TN,tn_2048_1_13_ld_13_13_2048,Default,0.00696544
GemmAndBiasTunableOp_BFloat16_TN,tn_2048_1_14_ld_14_14_2048,Default,0.00636928
GemmAndBiasTunableOp_BFloat16_TN,tn_2048_1_12_ld_12_12_2048,Default,0.00611104
GemmAndBiasTunableOp_BFloat16_TN,tn_2048_1_18_ld_18_18_2048,Default,0.00662592
GemmAndBiasTunableOp_BFloat16_TN,tn_2048_1_16_ld_16_16_2048,Default,0.0079712
GemmAndBiasTunableOp_BFloat16_TN,tn_2048_1_19_ld_19_19_2048,Default,0.00639648
GemmAndBiasTunableOp_BFloat16_TN,tn_2048_1_17_ld_17_17_2048,Default,0.00796384
GemmAndBiasTunableOp_BFloat16_TN,tn_2048_1_21_ld_21_21_2048,Default,0.00821792
GemmAndBiasTunableOp_BFloat16_TN,tn_2048_1_25_ld_25_25_2048,Default,0.00855072
GemmAndBiasTunableOp_BFloat16_TN,tn_2048_1_26_ld_26_26_2048,Default,0.00827136
GemmAndBiasTunableOp_BFloat16_TN,tn_2048_1_27_ld_27_27_2048,Default,0.00816032
GemmAndBiasTunableOp_BFloat16_TN,tn_2048_1_24_ld_24_24_2048,Default,0.00561472
GemmAndBiasTunableOp_BFloat16_TN,tn_2048_1_22_ld_22_22_2048,Default,0.0089616
GemmAndBiasTunableOp_BFloat16_TN,tn_512_1_5_ld_5_5_512,Default,0.0067904
GemmTunableOp_float_NN,nn_22_32_1_ld_22_1_22,Default,0.00592992
GemmTunableOp_float_TN,tn_16_22_2048_ld_2048_2048_16,Default,0.0100026
GemmTunableOp_float_TN,tn_2048_22_16_ld_16_16_2048,Default,0.00567968
GemmTunableOp_float_TN,tn_512_22_16_ld_16_16_512,Default,0.00809632
GemmTunableOp_BFloat16_TN,tn_2048_22_4_ld_4_4_2048,Default,0.00907808
GemmTunableOp_BFloat16_TN,tn_8192_22_3_ld_3_3_8192,Default,0.00675584
GemmTunableOp_BFloat16_TN,tn_2048_22_5_ld_5_5_2048,Default,0.00613728
GemmTunableOp_BFloat16_TN,tn_8192_22_5_ld_5_5_8192,Default,0.00688608
GemmTunableOp_BFloat16_NN,nn_2048_22_1_ld_1_1_2048,Default,0.00600704
GemmTunableOp_BFloat16_NN,nn_512_22_1_ld_1_1_512,Default,0.00657184
GemmTunableOp_BFloat16_TN,tn_2048_22_2_ld_2_2_2048,Default,0.00922912
GemmTunableOp_BFloat16_TN,tn_512_22_2_ld_2_2_512,Default,0.00617088
GemmTunableOp_BFloat16_TN,tn_8192_22_4_ld_4_4_8192,Default,0.00852736
GemmTunableOp_BFloat16_TN,tn_2048_22_3_ld_3_3_2048,Default,0.00614016
GemmTunableOp_BFloat16_TN,tn_512_22_3_ld_3_3_512,Default,0.00609376
GemmTunableOp_BFloat16_TN,tn_512_22_4_ld_4_4_512,Default,0.0095504
GemmTunableOp_BFloat16_TN,tn_512_22_5_ld_5_5_512,Default,0.00665664
GemmTunableOp_BFloat16_TN,tn_2048_22_7_ld_7_7_2048,Default,0.00708928
GemmTunableOp_BFloat16_TN,tn_2048_22_27_ld_27_27_2048,Default,0.00675712
GemmTunableOp_float_NN,nn_5_32_1_ld_5_1_5,Default,0.00636672
GemmTunableOp_float_TN,tn_16_5_2048_ld_2048_2048_16,Default,0.0213098
GemmTunableOp_float_TN,tn_2048_5_16_ld_16_16_2048,Default,0.00627712
GemmTunableOp_float_TN,tn_512_5_16_ld_16_16_512,Default,0.0060208
GemmTunableOp_BFloat16_TN,tn_2048_5_2_ld_2_2_2048,Default,0.0066592
GemmTunableOp_BFloat16_TN,tn_8192_5_2_ld_2_2_8192,Default,0.00659104
GemmTunableOp_BFloat16_TN,tn_2048_5_4_ld_4_4_2048,Default,0.0066352
GemmTunableOp_BFloat16_TN,tn_8192_5_4_ld_4_4_8192,Default,0.00853472
GemmTunableOp_BFloat16_TN,tn_8192_5_3_ld_3_3_8192,Default,0.013561
GemmTunableOp_BFloat16_TN,tn_512_5_2_ld_2_2_512,Default,0.00696928
GemmTunableOp_BFloat16_NN,nn_2048_5_1_ld_1_1_2048,Default,0.00657408
GemmTunableOp_BFloat16_NN,nn_512_5_1_ld_1_1_512,Default,0.00698112
GemmTunableOp_BFloat16_TN,tn_2048_5_8_ld_8_8_2048,Default,0.00750816
GemmTunableOp_float_NN,nn_23_32_1_ld_23_1_23,Default,0.0061904
GemmTunableOp_float_TN,tn_16_23_2048_ld_2048_2048_16,Default,0.009632
GemmTunableOp_float_TN,tn_2048_23_16_ld_16_16_2048,Default,0.00657824
GemmTunableOp_float_TN,tn_512_23_16_ld_16_16_512,Default,0.0109965
GemmTunableOp_BFloat16_TN,tn_2048_23_2_ld_2_2_2048,Default,0.00947104
GemmTunableOp_BFloat16_TN,tn_8192_23_2_ld_2_2_8192,Default,0.00884512
GemmTunableOp_BFloat16_TN,tn_2048_23_4_ld_4_4_2048,Default,0.009456
GemmTunableOp_BFloat16_TN,tn_8192_23_4_ld_4_4_8192,Default,0.00770976
GemmTunableOp_BFloat16_NN,nn_2048_23_1_ld_1_1_2048,Default,0.0062352
GemmTunableOp_BFloat16_NN,nn_512_23_1_ld_1_1_512,Default,0.00618944
GemmTunableOp_BFloat16_TN,tn_8192_23_3_ld_3_3_8192,Default,0.00636
GemmTunableOp_BFloat16_TN,tn_512_23_2_ld_2_2_512,Default,0.00725664
GemmTunableOp_BFloat16_TN,tn_2048_23_18_ld_18_18_2048,Default,0.00944352
GemmTunableOp_float_NN,nn_38_32_1_ld_38_1_38,Default,0.00620544
GemmTunableOp_float_TN,tn_16_38_2048_ld_2048_2048_16,Default,0.00968992
GemmTunableOp_float_TN,tn_2048_38_16_ld_16_16_2048,Default,0.00707168
GemmTunableOp_float_TN,tn_512_38_16_ld_16_16_512,Default,0.00896832
GemmTunableOp_BFloat16_TN,tn_2048_38_5_ld_5_5_2048,Default,0.00662304
GemmTunableOp_BFloat16_TN,tn_8192_38_3_ld_3_3_8192,Default,0.00728384
GemmTunableOp_BFloat16_TN,tn_8192_38_5_ld_5_5_8192,Default,0.00668768
GemmTunableOp_BFloat16_NN,nn_2048_38_1_ld_1_1_2048,Default,0.00698688
GemmTunableOp_BFloat16_TN,tn_2048_38_3_ld_3_3_2048,Default,0.00803488
GemmTunableOp_BFloat16_TN,tn_512_38_3_ld_3_3_512,Default,0.00711616
GemmTunableOp_BFloat16_TN,tn_2048_38_4_ld_4_4_2048,Default,0.00969632
GemmTunableOp_BFloat16_TN,tn_512_38_4_ld_4_4_512,Default,0.00685472
GemmTunableOp_BFloat16_TN,tn_8192_38_4_ld_4_4_8192,Default,0.00974048
GemmTunableOp_BFloat16_TN,tn_2048_38_6_ld_6_6_2048,Default,0.0107261
GemmTunableOp_BFloat16_TN,tn_2048_38_9_ld_9_9_2048,Default,0.00665632
GemmTunableOp_BFloat16_TN,tn_8192_38_6_ld_6_6_8192,Default,0.00807616
GemmTunableOp_BFloat16_TN,tn_2048_38_28_ld_28_28_2048,Default,0.00713728
GemmTunableOp_float_TN,tn_8192_2048_5_ld_5_5_8192,Default,0.245252
GemmTunableOp_float_TN,tn_512_2048_22_ld_22_22_512,Default,0.0107965
GemmTunableOp_float_TN,tn_8192_2048_6_ld_6_6_8192,Default,0.241976
GemmTunableOp_float_TN,tn_2048_2048_46_ld_46_46_2048,Default,0.0552131
GemmTunableOp_float_TN,tn_2048_2048_21_ld_21_21_2048,Default,0.0497635
GemmTunableOp_float_TN,tn_512_2048_21_ld_21_21_512,Default,0.0130918
GemmTunableOp_float_TN,tn_512_2048_23_ld_23_23_512,Default,0.010943
GemmTunableOp_float_TN,tn_2048_2048_43_ld_43_43_2048,Default,0.0573597
GemmTunableOp_float_TN,tn_2048_2048_52_ld_52_52_2048,Default,0.061631
GemmTunableOp_float_TN,tn_2048_2048_50_ld_50_50_2048,Default,0.066343
GemmTunableOp_float_TN,tn_2048_2048_55_ld_55_55_2048,Default,0.0676365
GemmTunableOp_float_TN,tn_2048_2048_51_ld_51_51_2048,Default,0.0638141
GemmTunableOp_float_TN,tn_2048_2048_57_ld_57_57_2048,Default,0.0647856
GemmTunableOp_float_TN,tn_2048_2048_56_ld_56_56_2048,Default,0.0623331
GemmTunableOp_float_TN,tn_2048_2048_54_ld_54_54_2048,Default,0.0667501
GemmTunableOp_float_TN,tn_2048_2048_59_ld_59_59_2048,Default,0.0652288
GemmTunableOp_float_TN,tn_2048_2048_61_ld_61_61_2048,Default,0.0650432
GemmTunableOp_float_TN,tn_2048_2048_63_ld_63_63_2048,Default,0.0652822
GemmTunableOp_float_TN,tn_2048_2048_58_ld_58_58_2048,Default,0.064904
GemmTunableOp_float_TN,tn_512_2048_24_ld_24_24_512,Default,0.0112685
GemmTunableOp_float_TN,tn_2048_2048_65_ld_65_65_2048,Default,0.0746013
GemmTunableOp_float_TN,tn_2048_2048_62_ld_62_62_2048,Default,0.0648867
GemmTunableOp_float_TN,tn_2048_2048_67_ld_67_67_2048,Default,0.0793888
GemmTunableOp_float_TN,tn_2048_2048_60_ld_60_60_2048,Default,0.0646285
GemmTunableOp_float_TN,tn_2048_2048_64_ld_64_64_2048,Default,0.0668413
GemmTunableOp_float_TN,tn_2048_2048_68_ld_68_68_2048,Default,0.0792666
GemmTunableOp_float_TN,tn_2048_2048_69_ld_69_69_2048,Default,0.0794368
GemmTunableOp_float_TN,tn_2048_2048_71_ld_71_71_2048,Default,0.086295
GemmTunableOp_float_TN,tn_2048_2048_66_ld_66_66_2048,Default,0.0724198
GemmTunableOp_float_TN,tn_2048_2048_53_ld_53_53_2048,Default,0.0628448
GemmTunableOp_float_TN,tn_2048_2048_49_ld_49_49_2048,Default,0.0677648
GemmTunableOp_float_TN,tn_2048_2048_48_ld_48_48_2048,Default,0.0603542
GemmTunableOp_float_NN,nn_37_32_1_ld_37_1_37,Default,0.00637408
GemmTunableOp_float_TN,tn_16_37_2048_ld_2048_2048_16,Default,0.0096512
GemmTunableOp_float_TN,tn_2048_37_16_ld_16_16_2048,Default,0.005432
GemmTunableOp_float_TN,tn_512_37_16_ld_16_16_512,Default,0.0089264
GemmTunableOp_BFloat16_TN,tn_2048_37_5_ld_5_5_2048,Default,0.0063392
GemmTunableOp_BFloat16_TN,tn_8192_37_3_ld_3_3_8192,Default,0.00669632
GemmTunableOp_BFloat16_TN,tn_8192_37_5_ld_5_5_8192,Default,0.0065024
GemmTunableOp_BFloat16_NN,nn_2048_37_1_ld_1_1_2048,Default,0.00623968
GemmTunableOp_BFloat16_TN,tn_2048_37_3_ld_3_3_2048,Default,0.0063408
GemmTunableOp_BFloat16_TN,tn_512_37_3_ld_3_3_512,Default,0.00642048
GemmTunableOp_BFloat16_TN,tn_2048_37_4_ld_4_4_2048,Default,0.0094288
GemmTunableOp_BFloat16_TN,tn_512_37_4_ld_4_4_512,Default,0.00775872
GemmTunableOp_BFloat16_TN,tn_8192_37_4_ld_4_4_8192,Default,0.0120445
GemmTunableOp_BFloat16_TN,tn_2048_37_2_ld_2_2_2048,Default,0.00938304
GemmTunableOp_BFloat16_TN,tn_2048_37_9_ld_9_9_2048,Default,0.00649408
GemmTunableOp_BFloat16_TN,tn_8192_37_6_ld_6_6_8192,Default,0.00828736
GemmTunableOp_BFloat16_TN,tn_2048_37_26_ld_26_26_2048,Default,0.00939744
GemmTunableOp_float_NN,nn_33_32_1_ld_33_1_33,Default,0.00647104
GemmTunableOp_float_TN,tn_16_33_2048_ld_2048_2048_16,Default,0.0131082
GemmTunableOp_float_TN,tn_2048_33_16_ld_16_16_2048,Default,0.00670656
GemmTunableOp_float_TN,tn_512_33_16_ld_16_16_512,Default,0.00979264
GemmTunableOp_BFloat16_TN,tn_2048_33_5_ld_5_5_2048,Default,0.00664768
GemmTunableOp_BFloat16_TN,tn_8192_33_3_ld_3_3_8192,Default,0.00673408
GemmTunableOp_BFloat16_TN,tn_8192_33_5_ld_5_5_8192,Default,0.00677248
GemmTunableOp_BFloat16_NN,nn_2048_33_1_ld_1_1_2048,Default,0.00789088
GemmTunableOp_BFloat16_TN,tn_2048_33_3_ld_3_3_2048,Default,0.00563808
GemmTunableOp_BFloat16_TN,tn_512_33_3_ld_3_3_512,Default,0.00827552
GemmTunableOp_BFloat16_TN,tn_2048_33_4_ld_4_4_2048,Default,0.00948256
GemmTunableOp_BFloat16_TN,tn_512_33_4_ld_4_4_512,Default,0.00766048
GemmTunableOp_BFloat16_TN,tn_8192_33_4_ld_4_4_8192,Default,0.0108678
GemmTunableOp_BFloat16_TN,tn_2048_33_9_ld_9_9_2048,Default,0.00659904
GemmTunableOp_BFloat16_TN,tn_8192_33_6_ld_6_6_8192,Default,0.0108614
GemmTunableOp_BFloat16_TN,tn_2048_33_26_ld_26_26_2048,Default,0.0102877
GemmTunableOp_float_NN,nn_63_32_1_ld_63_1_63,Default,0.00585728
GemmTunableOp_float_TN,tn_16_63_2048_ld_2048_2048_16,Default,0.0132032
GemmTunableOp_float_TN,tn_2048_63_16_ld_16_16_2048,Default,0.00579488
GemmTunableOp_float_TN,tn_512_63_16_ld_16_16_512,Default,0.00861568
GemmTunableOp_BFloat16_TN,tn_2048_63_5_ld_5_5_2048,Default,0.00669152
GemmTunableOp_BFloat16_TN,tn_8192_63_3_ld_3_3_8192,Default,0.00720544
GemmTunableOp_BFloat16_TN,tn_8192_63_5_ld_5_5_8192,Default,0.00680224
GemmTunableOp_BFloat16_NN,nn_2048_63_1_ld_1_1_2048,Default,0.00671072
GemmTunableOp_BFloat16_TN,tn_2048_63_3_ld_3_3_2048,Default,0.00709952
GemmTunableOp_BFloat16_TN,tn_512_63_3_ld_3_3_512,Default,0.00593536
GemmTunableOp_BFloat16_TN,tn_2048_63_4_ld_4_4_2048,Default,0.00947424
GemmTunableOp_BFloat16_TN,tn_512_63_4_ld_4_4_512,Default,0.00676896
GemmTunableOp_BFloat16_TN,tn_8192_63_4_ld_4_4_8192,Default,0.00919424
GemmTunableOp_BFloat16_TN,tn_512_63_5_ld_5_5_512,Default,0.00617312
GemmTunableOp_BFloat16_TN,tn_2048_63_6_ld_6_6_2048,Default,0.0106147
GemmTunableOp_BFloat16_TN,tn_512_63_6_ld_6_6_512,Default,0.00623648
GemmTunableOp_BFloat16_TN,tn_2048_63_7_ld_7_7_2048,Default,0.00562208
GemmTunableOp_BFloat16_TN,tn_2048_63_10_ld_10_10_2048,Default,0.0107002
GemmTunableOp_BFloat16_TN,tn_8192_63_6_ld_6_6_8192,Default,0.0068128
GemmTunableOp_BFloat16_TN,tn_2048_63_36_ld_36_36_2048,Default,0.00672064
GemmTunableOp_float_TN,tn_2048_2048_72_ld_72_72_2048,Default,0.071585
GemmTunableOp_float_TN,tn_2048_2048_70_ld_70_70_2048,Default,0.0833046
GemmTunableOp_float_TN,tn_2048_2048_45_ld_45_45_2048,Default,0.0594704
GemmTunableOp_float_TN,tn_2048_2048_47_ld_47_47_2048,Default,0.0590509
GemmTunableOp_float_TN,tn_2048_2048_44_ld_44_44_2048,Default,0.0577894
GemmTunableOp_float_TN,tn_2048_2048_41_ld_41_41_2048,Default,0.0577027
GemmTunableOp_float_TN,tn_2048_2048_42_ld_42_42_2048,Default,0.0597808
GemmTunableOp_BFloat16_TN,tn_2048_33_6_ld_6_6_2048,Default,0.00949344
GemmTunableOp_BFloat16_TN,tn_2048_33_25_ld_25_25_2048,Default,0.00820608
GemmTunableOp_float_NN,nn_65_32_1_ld_65_1_65,Default,0.00718656
GemmTunableOp_float_TN,tn_16_65_2048_ld_2048_2048_16,Default,0.00955808
GemmTunableOp_float_TN,tn_2048_65_16_ld_16_16_2048,Default,0.00566368
GemmTunableOp_float_TN,tn_512_65_16_ld_16_16_512,Default,0.00804576
GemmTunableOp_BFloat16_TN,tn_2048_65_5_ld_5_5_2048,Default,0.00592544
GemmTunableOp_BFloat16_TN,tn_8192_65_3_ld_3_3_8192,Default,0.00759264
GemmTunableOp_BFloat16_TN,tn_8192_65_5_ld_5_5_8192,Default,0.0111958
GemmTunableOp_BFloat16_NN,nn_2048_65_1_ld_1_1_2048,Default,0.0065376
GemmTunableOp_BFloat16_TN,tn_2048_65_3_ld_3_3_2048,Default,0.00608224
GemmTunableOp_BFloat16_TN,tn_512_65_3_ld_3_3_512,Default,0.00668576
GemmTunableOp_BFloat16_TN,tn_2048_65_4_ld_4_4_2048,Default,0.00654464
GemmTunableOp_BFloat16_TN,tn_512_65_4_ld_4_4_512,Default,0.00741568
GemmTunableOp_BFloat16_TN,tn_8192_65_4_ld_4_4_8192,Default,0.00727296
GemmTunableOp_BFloat16_TN,tn_512_65_5_ld_5_5_512,Default,0.00640128
GemmTunableOp_BFloat16_TN,tn_2048_65_7_ld_7_7_2048,Default,0.00562912
GemmTunableOp_BFloat16_TN,tn_512_65_7_ld_7_7_512,Default,0.0062704
GemmTunableOp_BFloat16_TN,tn_2048_65_6_ld_6_6_2048,Default,0.00698368
GemmTunableOp_BFloat16_TN,tn_512_65_6_ld_6_6_512,Default,0.00642912
GemmTunableOp_BFloat16_TN,tn_2048_65_9_ld_9_9_2048,Default,0.00710016
GemmTunableOp_BFloat16_TN,tn_8192_65_6_ld_6_6_8192,Default,0.00673088
GemmTunableOp_BFloat16_TN,tn_2048_65_31_ld_31_31_2048,Default,0.00563424
GemmTunableOp_float_NN,nn_35_32_1_ld_35_1_35,Default,0.00570688
GemmTunableOp_float_TN,tn_16_35_2048_ld_2048_2048_16,Default,0.00977696
GemmTunableOp_float_TN,tn_2048_35_16_ld_16_16_2048,Default,0.00601792
GemmTunableOp_float_TN,tn_512_35_16_ld_16_16_512,Default,0.0083616
GemmTunableOp_BFloat16_TN,tn_2048_35_5_ld_5_5_2048,Default,0.00704512
GemmTunableOp_BFloat16_TN,tn_8192_35_3_ld_3_3_8192,Default,0.00711392
GemmTunableOp_BFloat16_TN,tn_8192_35_5_ld_5_5_8192,Default,0.00771968
GemmTunableOp_BFloat16_NN,nn_2048_35_1_ld_1_1_2048,Default,0.00705248
GemmTunableOp_BFloat16_TN,tn_2048_35_3_ld_3_3_2048,Default,0.0072496
GemmTunableOp_BFloat16_TN,tn_512_35_3_ld_3_3_512,Default,0.00690368
GemmTunableOp_BFloat16_TN,tn_2048_35_4_ld_4_4_2048,Default,0.00960352
GemmTunableOp_BFloat16_TN,tn_512_35_4_ld_4_4_512,Default,0.00686368
GemmTunableOp_BFloat16_TN,tn_8192_35_4_ld_4_4_8192,Default,0.00973472
GemmTunableOp_BFloat16_TN,tn_512_35_5_ld_5_5_512,Default,0.00807808
GemmTunableOp_BFloat16_TN,tn_2048_35_7_ld_7_7_2048,Default,0.00593536
GemmTunableOp_BFloat16_TN,tn_2048_35_9_ld_9_9_2048,Default,0.00820992
GemmTunableOp_BFloat16_TN,tn_8192_35_6_ld_6_6_8192,Default,0.0098224
GemmTunableOp_BFloat16_TN,tn_2048_35_25_ld_25_25_2048,Default,0.00601024
GemmTunableOp_BFloat16_TN,tn_2048_65_2_ld_2_2_2048,Default,0.00686176
GemmTunableOp_BFloat16_TN,tn_2048_65_30_ld_30_30_2048,Default,0.0064944
GemmTunableOp_float_TN,tn_8192_1024_5_ld_5_5_8192,Default,0.0394442
GemmTunableOp_float_TN,tn_512_1024_4_ld_4_4_512,Default,0.00764192
GemmTunableOp_float_TN,tn_2048_1024_17_ld_17_17_2048,Default,0.0175472
GemmTunableOp_float_TN,tn_512_1024_17_ld_17_17_512,Default,0.0132589
GemmTunableOp_float_TN,tn_2048_1024_14_ld_14_14_2048,Default,0.0190464
GemmTunableOp_float_TN,tn_2048_1024_15_ld_15_15_2048,Default,0.0154163
GemmTunableOp_float_TN,tn_8192_1024_6_ld_6_6_8192,Default,0.0412669
GemmTunableOp_float_TN,tn_2048_1024_49_ld_49_49_2048,Default,0.0291699
GemmTunableOp_float_TN,tn_512_1024_15_ld_15_15_512,Default,0.0118733
GemmTunableOp_float_TN,tn_2048_1024_19_ld_19_19_2048,Default,0.0214595
GemmTunableOp_float_TN,tn_512_1024_19_ld_19_19_512,Default,0.013664
GemmTunableOp_float_TN,tn_2048_1024_44_ld_44_44_2048,Default,0.0270288
GemmTunableOp_float_TN,tn_512_1024_14_ld_14_14_512,Default,0.0091024
GemmTunableOp_float_TN,tn_2048_1024_41_ld_41_41_2048,Default,0.0255245
GemmTunableOp_BFloat16_TN,tn_2048_63_2_ld_2_2_2048,Default,0.0096624
GemmTunableOp_BFloat16_TN,tn_2048_63_8_ld_8_8_2048,Default,0.00705888
GemmTunableOp_BFloat16_TN,tn_512_63_8_ld_8_8_512,Default,0.00688896
GemmTunableOp_BFloat16_TN,tn_2048_63_9_ld_9_9_2048,Default,0.00674464
GemmTunableOp_BFloat16_TN,tn_2048_63_30_ld_30_30_2048,Default,0.0062528
GemmTunableOp_float_NN,nn_2048_32_1_ld_2048_1_2048,Default,0.00772288
GemmTunableOp_float_TN,tn_16_8192_2048_ld_2048_2048_16,Default,0.2309
GemmTunableOp_float_TN,tn_2048_8192_16_ld_16_16_2048,Default,0.107828
GemmTunableOp_float_TN,tn_512_8192_16_ld_16_16_512,Default,0.0274899
GemmStridedBatchedTunableOp_float_TN,tn_2048_2048_64_B_32_ld_64_2048_2048,Default,1.37404
GemmStridedBatchedTunableOp_float_NN,nn_64_2048_2048_B_32_ld_64_2048_64,Default,1.14854
GemmStridedBatchedTunableOp_float_NT,nt_64_2048_2048_B_32_ld_2048_2048_64,Default,0.967329
GemmStridedBatchedTunableOp_float_NT,nt_2048_64_2048_B_32_ld_2048_2048_2048,Default,1.16238
GemmTunableOp_float_TN,tn_2048_2048_35_ld_35_35_2048,Default,0.0601594
GemmTunableOp_float_TN,tn_2048_2048_36_ld_36_36_2048,Default,0.0581277
GemmTunableOp_float_TN,tn_2048_2048_37_ld_37_37_2048,Default,0.061264
GemmTunableOp_float_TN,tn_2048_2048_34_ld_34_34_2048,Default,0.0582227
GemmTunableOp_float_TN,tn_2048_2048_38_ld_38_38_2048,Default,0.0597328
GemmTunableOp_float_TN,tn_2048_2048_40_ld_40_40_2048,Default,0.0488954
GemmTunableOp_float_TN,tn_2048_2048_39_ld_39_39_2048,Default,0.0577901
GemmTunableOp_float_TN,tn_2048_2048_73_ld_73_73_2048,Default,0.0727088
GemmTunableOp_float_TN,tn_2048_2048_77_ld_77_77_2048,Default,0.0714394
GemmTunableOp_float_TN,tn_2048_2048_74_ld_74_74_2048,Default,0.0701318
GemmTunableOp_float_NN,nn_97_32_1_ld_97_1_97,Default,0.00665568
GemmTunableOp_float_TN,tn_16_97_2048_ld_2048_2048_16,Default,0.00974688
GemmTunableOp_float_TN,tn_2048_97_16_ld_16_16_2048,Default,0.00628928
GemmTunableOp_float_TN,tn_512_97_16_ld_16_16_512,Default,0.00755264
GemmTunableOp_BFloat16_TN,tn_2048_97_4_ld_4_4_2048,Default,0.00639008
GemmTunableOp_BFloat16_TN,tn_8192_97_3_ld_3_3_8192,Default,0.0120192
GemmTunableOp_BFloat16_TN,tn_2048_97_5_ld_5_5_2048,Default,0.00685696
GemmTunableOp_BFloat16_TN,tn_8192_97_5_ld_5_5_8192,Default,0.00951872
GemmTunableOp_BFloat16_TN,tn_2048_97_2_ld_2_2_2048,Default,0.0065744
GemmTunableOp_BFloat16_TN,tn_512_97_2_ld_2_2_512,Default,0.0105158
GemmTunableOp_BFloat16_TN,tn_2048_97_3_ld_3_3_2048,Default,0.00678592
GemmTunableOp_BFloat16_TN,tn_512_97_3_ld_3_3_512,Default,0.00665024
GemmTunableOp_BFloat16_TN,tn_8192_97_4_ld_4_4_8192,Default,0.00988768
GemmTunableOp_BFloat16_TN,tn_512_97_5_ld_5_5_512,Default,0.00660448
GemmTunableOp_BFloat16_NN,nn_2048_97_1_ld_1_1_2048,Default,0.00651552
GemmTunableOp_BFloat16_TN,tn_2048_97_9_ld_9_9_2048,Default,0.00680256
GemmTunableOp_BFloat16_TN,tn_512_97_9_ld_9_9_512,Default,0.00724672
GemmTunableOp_BFloat16_TN,tn_2048_97_6_ld_6_6_2048,Default,0.00687872
GemmTunableOp_BFloat16_TN,tn_512_97_6_ld_6_6_512,Default,0.00866464
GemmTunableOp_BFloat16_TN,tn_512_97_4_ld_4_4_512,Default,0.0066848
GemmTunableOp_BFloat16_TN,tn_2048_97_8_ld_8_8_2048,Default,0.0114608
GemmTunableOp_BFloat16_TN,tn_2048_97_7_ld_7_7_2048,Default,0.00647488
GemmTunableOp_BFloat16_TN,tn_2048_97_27_ld_27_27_2048,Default,0.00847264
GemmTunableOp_float_NN,nn_1024_32_1_ld_1024_1_1024,Default,0.00663744
GemmTunableOp_float_TN,tn_32_1024_2048_ld_2048_2048_32,Default,0.0296083
GemmTunableOp_float_TN,tn_2048_1024_32_ld_32_32_2048,Default,0.0171181
GemmTunableOp_float_TN,tn_512_1024_32_ld_32_32_512,Default,0.00850208
GemmStridedBatchedTunableOp_float_TN,tn_1024_1024_64_B_32_ld_64_2048_1024,Default,0.346308
GemmStridedBatchedTunableOp_float_NN,nn_64_1024_1024_B_32_ld_64_1024_64,Default,0.297985
GemmTunableOp_float_TN,tn_2048_1024_20_ld_20_20_2048,Default,0.0169699
GemmTunableOp_float_TN,tn_512_1024_20_ld_20_20_512,Default,0.0132947
GemmTunableOp_float_TN,tn_512_1024_23_ld_23_23_512,Default,0.0127606
GemmTunableOp_float_TN,tn_2048_1024_46_ld_46_46_2048,Default,0.0277382
GemmTunableOp_float_NT,nt_32_2048_1024_ld_32_2048_32,Default,0.0213184
GemmTunableOp_float_NN,nn_32_1024_2048_ld_32_2048_32,Default,0.0261088
GemmTunableOp_float_NT,nt_2048_32_1024_ld_2048_32_2048,Default,0.024401
GemmTunableOp_float_NN,nn_2048_1024_32_ld_2048_32_2048,Default,0.0151427
GemmStridedBatchedTunableOp_float_NT,nt_64_1024_1024_B_32_ld_2048_1024_64,Default,0.252259
GemmStridedBatchedTunableOp_float_NT,nt_1024_64_1024_B_32_ld_1024_2048_1024,Default,0.303701
GemmTunableOp_float_NT,nt_32_512_1024_ld_32_512_32,Default,0.0094656
GemmTunableOp_float_NN,nn_32_1024_512_ld_32_512_32,Default,0.0105875
GemmTunableOp_float_TN,tn_2048_1024_36_ld_36_36_2048,Default,0.0271296
GemmTunableOp_float_TN,tn_2048_1024_12_ld_12_12_2048,Default,0.0154797
GemmTunableOp_float_TN,tn_512_1024_12_ld_12_12_512,Default,0.00854784
GemmTunableOp_float_TN,tn_512_1024_24_ld_24_24_512,Default,0.015015
GemmTunableOp_float_TN,tn_2048_1024_22_ld_22_22_2048,Default,0.0210666
GemmTunableOp_float_TN,tn_512_1024_22_ld_22_22_512,Default,0.0150291
GemmTunableOp_float_TN,tn_2048_1024_18_ld_18_18_2048,Default,0.0170211
GemmTunableOp_float_TN,tn_2048_1024_48_ld_48_48_2048,Default,0.0284982
GemmTunableOp_float_TN,tn_512_1024_25_ld_25_25_512,Default,0.0152301
GemmTunableOp_float_TN,tn_2048_1024_50_ld_50_50_2048,Default,0.0326733
GemmTunableOp_float_TN,tn_512_1024_18_ld_18_18_512,Default,0.0133558
GemmTunableOp_float_TN,tn_2048_1024_45_ld_45_45_2048,Default,0.0276019
GemmTunableOp_float_TN,tn_2048_1024_40_ld_40_40_2048,Default,0.0240486
GemmTunableOp_float_TN,tn_2048_1024_53_ld_53_53_2048,Default,0.0302653
GemmTunableOp_float_TN,tn_2048_1024_47_ld_47_47_2048,Default,0.026473
GemmTunableOp_float_TN,tn_2048_1024_34_ld_34_34_2048,Default,0.0265862
GemmTunableOp_float_TN,tn_2048_1024_38_ld_38_38_2048,Default,0.0274835
GemmTunableOp_float_TN,tn_2048_1024_21_ld_21_21_2048,Default,0.0176854
GemmTunableOp_float_TN,tn_512_1024_21_ld_21_21_512,Default,0.0135155
GemmTunableOp_float_TN,tn_2048_1024_58_ld_58_58_2048,Default,0.0333104
GemmTunableOp_float_TN,tn_2048_1024_42_ld_42_42_2048,Default,0.0268435
GemmTunableOp_float_TN,tn_2048_1024_39_ld_39_39_2048,Default,0.0298794
GemmTunableOp_float_TN,tn_2048_1024_51_ld_51_51_2048,Default,0.0312112
GemmTunableOp_float_TN,tn_2048_1024_56_ld_56_56_2048,Default,0.0298374
GemmTunableOp_float_TN,tn_2048_1024_57_ld_57_57_2048,Default,0.0307792
GemmTunableOp_float_TN,tn_2048_1024_61_ld_61_61_2048,Default,0.032592
GemmTunableOp_float_TN,tn_2048_1024_43_ld_43_43_2048,Default,0.025264
GemmTunableOp_float_TN,tn_2048_1024_54_ld_54_54_2048,Default,0.0293811
GemmTunableOp_float_TN,tn_2048_1024_52_ld_52_52_2048,Default,0.0286454
GemmTunableOp_float_TN,tn_2048_1024_67_ld_67_67_2048,Default,0.0421635
GemmTunableOp_float_TN,tn_2048_1024_37_ld_37_37_2048,Default,0.02724
GemmTunableOp_float_TN,tn_2048_1024_66_ld_66_66_2048,Default,0.0375322
GemmTunableOp_float_TN,tn_2048_1024_62_ld_62_62_2048,Default,0.0297718
GemmTunableOp_float_TN,tn_2048_1024_55_ld_55_55_2048,Default,0.0292269
GemmTunableOp_float_TN,tn_2048_1024_35_ld_35_35_2048,Default,0.0255859
GemmTunableOp_float_TN,tn_2048_1024_33_ld_33_33_2048,Default,0.0249651
GemmTunableOp_float_TN,tn_2048_1024_29_ld_29_29_2048,Default,0.0220755
GemmTunableOp_float_TN,tn_2048_1024_59_ld_59_59_2048,Default,0.0305117
GemmTunableOp_float_TN,tn_2048_1024_65_ld_65_65_2048,Default,0.0357005
GemmTunableOp_float_TN,tn_2048_1024_60_ld_60_60_2048,Default,0.0294483
GemmTunableOp_float_TN,tn_2048_1024_69_ld_69_69_2048,Default,0.0416496
GemmTunableOp_float_TN,tn_2048_1024_64_ld_64_64_2048,Default,0.029233
GemmTunableOp_float_TN,tn_2048_1024_63_ld_63_63_2048,Default,0.0305197
GemmTunableOp_float_TN,tn_2048_1024_73_ld_73_73_2048,Default,0.0340042
GemmTunableOp_float_TN,tn_2048_1024_68_ld_68_68_2048,Default,0.0396349
GemmTunableOp_float_TN,tn_2048_1024_78_ld_78_78_2048,Default,0.0336192
GemmTunableOp_float_TN,tn_2048_1024_75_ld_75_75_2048,Default,0.0335216
GemmTunableOp_float_TN,tn_2048_1024_70_ld_70_70_2048,Default,0.0422051
GemmTunableOp_float_TN,tn_2048_1024_72_ld_72_72_2048,Default,0.0336608
GemmTunableOp_float_TN,tn_2048_1024_77_ld_77_77_2048,Default,0.0338906
GemmTunableOp_float_TN,tn_2048_1024_74_ld_74_74_2048,Default,0.0335603
GemmTunableOp_float_TN,tn_2048_1024_26_ld_26_26_2048,Default,0.0218477
GemmTunableOp_float_TN,tn_512_1024_26_ld_26_26_512,Default,0.0160112
GemmTunableOp_float_TN,tn_2048_1024_71_ld_71_71_2048,Default,0.0466054
GemmTunableOp_float_TN,tn_2048_1024_27_ld_27_27_2048,Default,0.0219075
GemmTunableOp_float_TN,tn_2048_1024_83_ld_83_83_2048,Default,0.037769
GemmTunableOp_float_TN,tn_2048_1024_79_ld_79_79_2048,Default,0.0338544
GemmTunableOp_float_TN,tn_2048_1024_76_ld_76_76_2048,Default,0.033775
GemmTunableOp_float_TN,tn_2048_1024_80_ld_80_80_2048,Default,0.0336682
GemmTunableOp_float_TN,tn_2048_1024_85_ld_85_85_2048,Default,0.0385059
GemmTunableOp_float_TN,tn_512_1024_27_ld_27_27_512,Default,0.0160835
GemmTunableOp_float_TN,tn_2048_1024_81_ld_81_81_2048,Default,0.0384211
GemmTunableOp_float_TN,tn_2048_1024_84_ld_84_84_2048,Default,0.0376806
GemmTunableOp_float_TN,tn_2048_1024_87_ld_87_87_2048,Default,0.038527
GemmTunableOp_float_TN,tn_2048_1024_96_ld_96_96_2048,Default,0.0372778
GemmTunableOp_float_TN,tn_2048_1024_31_ld_31_31_2048,Default,0.0233562
GemmTunableOp_float_TN,tn_2048_1024_101_ld_101_101_2048,Default,0.0427398
GemmTunableOp_float_TN,tn_2048_1024_86_ld_86_86_2048,Default,0.0383558
GemmTunableOp_float_TN,tn_2048_1024_28_ld_28_28_2048,Default,0.0226006
GemmTunableOp_float_TN,tn_2048_1024_30_ld_30_30_2048,Default,0.0225539
GemmTunableOp_float_TN,tn_2048_1024_88_ld_88_88_2048,Default,0.0372787
GemmTunableOp_float_TN,tn_2048_1024_90_ld_90_90_2048,Default,0.0379971
GemmTunableOp_float_TN,tn_2048_1024_82_ld_82_82_2048,Default,0.037871
GemmTunableOp_float_TN,tn_2048_1024_100_ld_100_100_2048,Default,0.041825
GemmTunableOp_float_TN,tn_2048_1024_111_ld_111_111_2048,Default,0.0428058
GemmTunableOp_float_TN,tn_512_1024_28_ld_28_28_512,Default,0.0136339
GemmTunableOp_float_TN,tn_2048_1024_89_ld_89_89_2048,Default,0.0382045
GemmTunableOp_float_TN,tn_2048_1024_99_ld_99_99_2048,Default,0.0423674
GemmTunableOp_float_TN,tn_2048_1024_95_ld_95_95_2048,Default,0.0387059
GemmTunableOp_float_TN,tn_2048_1024_92_ld_92_92_2048,Default,0.0384528
GemmTunableOp_float_TN,tn_2048_1024_98_ld_98_98_2048,Default,0.0421616
GemmTunableOp_float_TN,tn_2048_1024_91_ld_91_91_2048,Default,0.0386714
GemmTunableOp_float_TN,tn_2048_1024_93_ld_93_93_2048,Default,0.0384074
GemmTunableOp_float_TN,tn_512_1024_29_ld_29_29_512,Default,0.0130144
GemmTunableOp_float_TN,tn_2048_1024_107_ld_107_107_2048,Default,0.0423021
GemmTunableOp_float_TN,tn_2048_1024_94_ld_94_94_2048,Default,0.0388051
GemmTunableOp_float_TN,tn_2048_1024_105_ld_105_105_2048,Default,0.0426432
GemmTunableOp_float_TN,tn_2048_1024_112_ld_112_112_2048,Default,0.0407405
GemmTunableOp_float_TN,tn_2048_1024_102_ld_102_102_2048,Default,0.0420349
GemmTunableOp_float_TN,tn_2048_1024_119_ld_119_119_2048,Default,0.0459213
GemmTunableOp_float_TN,tn_2048_1024_104_ld_104_104_2048,Default,0.0410006
GemmTunableOp_float_TN,tn_2048_1024_97_ld_97_97_2048,Default,0.0425267
GemmTunableOp_float_TN,tn_2048_1024_103_ld_103_103_2048,Default,0.0423018
GemmTunableOp_float_NN,nn_79_32_1_ld_79_1_79,Default,0.00669632
GemmTunableOp_float_TN,tn_32_79_2048_ld_2048_2048_32,Default,0.0114794
GemmTunableOp_float_TN,tn_2048_79_32_ld_32_32_2048,Default,0.00702944
GemmTunableOp_float_TN,tn_512_79_32_ld_32_32_512,Default,0.010431
GemmTunableOp_BFloat16_TN,tn_2048_79_4_ld_4_4_2048,Default,0.00680128
GemmTunableOp_BFloat16_TN,tn_8192_79_3_ld_3_3_8192,Default,0.00790176
GemmTunableOp_BFloat16_TN,tn_2048_79_5_ld_5_5_2048,Default,0.00692672
GemmTunableOp_BFloat16_TN,tn_8192_79_5_ld_5_5_8192,Default,0.0079264
GemmTunableOp_BFloat16_TN,tn_2048_79_2_ld_2_2_2048,Default,0.00725472
GemmTunableOp_BFloat16_TN,tn_512_79_2_ld_2_2_512,Default,0.00626848
GemmTunableOp_BFloat16_TN,tn_2048_79_3_ld_3_3_2048,Default,0.00689152
GemmTunableOp_BFloat16_TN,tn_512_79_3_ld_3_3_512,Default,0.00608544
GemmTunableOp_BFloat16_TN,tn_8192_79_4_ld_4_4_8192,Default,0.0082752
GemmTunableOp_BFloat16_TN,tn_512_79_5_ld_5_5_512,Default,0.00686944
GemmTunableOp_BFloat16_NN,nn_2048_79_1_ld_1_1_2048,Default,0.00673056
GemmTunableOp_BFloat16_TN,tn_2048_79_13_ld_13_13_2048,Default,0.00690176
GemmTunableOp_BFloat16_TN,tn_512_79_13_ld_13_13_512,Default,0.00617856
GemmTunableOp_BFloat16_TN,tn_2048_79_6_ld_6_6_2048,Default,0.00686784
GemmTunableOp_BFloat16_TN,tn_512_79_6_ld_6_6_512,Default,0.00693824
GemmTunableOp_BFloat16_TN,tn_2048_79_9_ld_9_9_2048,Default,0.00678816
GemmTunableOp_BFloat16_TN,tn_512_79_9_ld_9_9_512,Default,0.00683232
GemmTunableOp_BFloat16_TN,tn_2048_79_8_ld_8_8_2048,Default,0.00962464
GemmTunableOp_BFloat16_TN,tn_512_79_8_ld_8_8_512,Default,0.00705056
GemmTunableOp_BFloat16_TN,tn_512_79_4_ld_4_4_512,Default,0.00803872
GemmTunableOp_BFloat16_TN,tn_2048_79_30_ld_30_30_2048,Default,0.00821888
GemmTunableOp_float_TN,tn_32_1_2048_ld_2048_2048_32,Default,0.00855392
GemmTunableOp_float_TN,tn_2048_1_32_ld_32_32_2048,Default,0.00854848
GemmTunableOp_float_TN,tn_512_1_32_ld_32_32_512,Default,0.00653888
GemmTunableOp_float_NN,nn_73_32_1_ld_73_1_73,Default,0.00649664
GemmTunableOp_float_TN,tn_32_73_2048_ld_2048_2048_32,Default,0.0114989
GemmTunableOp_float_TN,tn_2048_73_32_ld_32_32_2048,Default,0.00706432
GemmTunableOp_float_TN,tn_512_73_32_ld_32_32_512,Default,0.0123306
GemmTunableOp_BFloat16_TN,tn_2048_73_4_ld_4_4_2048,Default,0.0066816
GemmTunableOp_BFloat16_TN,tn_8192_73_3_ld_3_3_8192,Default,0.0094832
GemmTunableOp_BFloat16_TN,tn_2048_73_5_ld_5_5_2048,Default,0.00675136
GemmTunableOp_BFloat16_TN,tn_8192_73_5_ld_5_5_8192,Default,0.007968
GemmTunableOp_BFloat16_TN,tn_2048_73_2_ld_2_2_2048,Default,0.00642464
GemmTunableOp_BFloat16_TN,tn_512_73_2_ld_2_2_512,Default,0.00980896
GemmTunableOp_BFloat16_TN,tn_2048_73_3_ld_3_3_2048,Default,0.0058976
GemmTunableOp_BFloat16_TN,tn_512_73_3_ld_3_3_512,Default,0.00692608
GemmTunableOp_BFloat16_TN,tn_8192_73_4_ld_4_4_8192,Default,0.00753952
GemmTunableOp_BFloat16_TN,tn_512_73_4_ld_4_4_512,Default,0.00968224
GemmTunableOp_BFloat16_TN,tn_2048_73_10_ld_10_10_2048,Default,0.00678624
GemmTunableOp_BFloat16_TN,tn_512_73_10_ld_10_10_512,Default,0.00668544
GemmTunableOp_BFloat16_TN,tn_2048_73_6_ld_6_6_2048,Default,0.00798208
GemmTunableOp_BFloat16_TN,tn_512_73_6_ld_6_6_512,Default,0.00698624
GemmTunableOp_BFloat16_TN,tn_2048_73_8_ld_8_8_2048,Default,0.0098208
GemmTunableOp_BFloat16_TN,tn_512_73_8_ld_8_8_512,Default,0.00698144
GemmTunableOp_BFloat16_TN,tn_2048_73_7_ld_7_7_2048,Default,0.0082992
GemmTunableOp_BFloat16_TN,tn_512_73_7_ld_7_7_512,Default,0.00713184
GemmTunableOp_BFloat16_TN,tn_2048_73_31_ld_31_31_2048,Default,0.00595456
GemmTunableOp_float_TN,tn_2048_1024_108_ld_108_108_2048,Default,0.0416013
GemmTunableOp_float_TN,tn_2048_1024_126_ld_126_126_2048,Default,0.0461622
GemmTunableOp_float_TN,tn_2048_1024_106_ld_106_106_2048,Default,0.0424118
GemmTunableOp_float_NN,nn_125_32_1_ld_125_1_125,Default,0.00778112
GemmTunableOp_float_TN,tn_32_125_2048_ld_2048_2048_32,Default,0.0113952
GemmTunableOp_float_TN,tn_2048_125_32_ld_32_32_2048,Default,0.0090128
GemmTunableOp_float_TN,tn_512_125_32_ld_32_32_512,Default,0.0093312
GemmTunableOp_BFloat16_TN,tn_2048_125_4_ld_4_4_2048,Default,0.00664672
GemmTunableOp_BFloat16_TN,tn_8192_125_3_ld_3_3_8192,Default,0.00863424
GemmTunableOp_BFloat16_TN,tn_2048_125_5_ld_5_5_2048,Default,0.0078464
GemmTunableOp_BFloat16_TN,tn_8192_125_5_ld_5_5_8192,Default,0.011265
GemmTunableOp_BFloat16_TN,tn_2048_125_2_ld_2_2_2048,Default,0.00701312
GemmTunableOp_BFloat16_TN,tn_512_125_2_ld_2_2_512,Default,0.00612192
GemmTunableOp_BFloat16_TN,tn_2048_125_3_ld_3_3_2048,Default,0.00983808
GemmTunableOp_BFloat16_TN,tn_512_125_3_ld_3_3_512,Default,0.00675072
GemmTunableOp_BFloat16_TN,tn_8192_125_4_ld_4_4_8192,Default,0.0085424
GemmTunableOp_BFloat16_TN,tn_2048_125_6_ld_6_6_2048,Default,0.00841824
GemmTunableOp_BFloat16_TN,tn_512_125_6_ld_6_6_512,Default,0.00871072
GemmTunableOp_BFloat16_TN,tn_2048_125_14_ld_14_14_2048,Default,0.00830816
GemmTunableOp_BFloat16_TN,tn_512_125_14_ld_14_14_512,Default,0.00835616
GemmTunableOp_BFloat16_NN,nn_2048_125_1_ld_1_1_2048,Default,0.00637504
GemmTunableOp_BFloat16_TN,tn_512_125_5_ld_5_5_512,Default,0.00708736
GemmTunableOp_BFloat16_TN,tn_2048_125_11_ld_11_11_2048,Default,0.00686816
GemmTunableOp_BFloat16_TN,tn_512_125_11_ld_11_11_512,Default,0.00694944
GemmTunableOp_BFloat16_TN,tn_2048_125_10_ld_10_10_2048,Default,0.00678112
GemmTunableOp_BFloat16_TN,tn_2048_125_9_ld_9_9_2048,Default,0.006688
GemmTunableOp_BFloat16_TN,tn_512_125_9_ld_9_9_512,Default,0.00713312
GemmTunableOp_BFloat16_TN,tn_2048_125_8_ld_8_8_2048,Default,0.0124986
GemmTunableOp_BFloat16_TN,tn_2048_125_40_ld_40_40_2048,Default,0.00685568
GemmTunableOp_float_NN,nn_1500_32_1_ld_1500_1_1500,Default,0.00656224
GemmTunableOp_float_TN,tn_32_1500_2048_ld_2048_2048_32,Default,0.0352224
GemmTunableOp_float_TN,tn_2048_1500_32_ld_32_32_2048,Default,0.021049
GemmTunableOp_float_TN,tn_512_1500_32_ld_32_32_512,Default,0.0109187
GemmTunableOp_float_TN,tn_2048_1500_4_ld_4_4_2048,Default,0.0452448
GemmTunableOp_float_TN,tn_8192_1500_3_ld_3_3_8192,Default,0.0939603
GemmTunableOp_float_TN,tn_2048_1500_5_ld_5_5_2048,Default,0.0448643
GemmTunableOp_float_TN,tn_8192_1500_5_ld_5_5_8192,Default,0.0803645
GemmTunableOp_float_TN,tn_2048_1500_2_ld_2_2_2048,Default,0.0440643
GemmTunableOp_float_TN,tn_512_1500_2_ld_2_2_512,Default,0.0130509
GemmTunableOp_float_TN,tn_2048_1500_3_ld_3_3_2048,Default,0.0444781
GemmTunableOp_float_TN,tn_512_1500_3_ld_3_3_512,Default,0.0134678
GemmTunableOp_float_TN,tn_512_1500_4_ld_4_4_512,Default,0.0134717
GemmTunableOp_float_TN,tn_8192_1500_4_ld_4_4_8192,Default,0.0935789
GemmTunableOp_float_TN,tn_2048_1500_7_ld_7_7_2048,Default,0.0448419
GemmTunableOp_float_TN,tn_512_1500_7_ld_7_7_512,Default,0.0137261
GemmTunableOp_float_TN,tn_512_1500_5_ld_5_5_512,Default,0.0135837
GemmTunableOp_float_TN,tn_2048_1500_17_ld_17_17_2048,Default,0.043585
GemmTunableOp_float_TN,tn_512_1500_17_ld_17_17_512,Default,0.0089632
GemmTunableOp_float_TN,tn_2048_1500_8_ld_8_8_2048,Default,0.0453779
GemmTunableOp_float_TN,tn_512_1500_8_ld_8_8_512,Default,0.0138992
GemmTunableOp_float_TN,tn_2048_1500_12_ld_12_12_2048,Default,0.0463565
GemmTunableOp_float_TN,tn_512_1500_12_ld_12_12_512,Default,0.0112669
GemmTunableOp_float_TN,tn_2048_1500_20_ld_20_20_2048,Default,0.0465642
GemmTunableOp_float_TN,tn_512_1500_20_ld_20_20_512,Default,0.009584
GemmTunableOp_float_TN,tn_2048_1500_6_ld_6_6_2048,Default,0.0455536
GemmTunableOp_float_TN,tn_2048_1500_19_ld_19_19_2048,Default,0.0466182
GemmTunableOp_float_TN,tn_512_1500_19_ld_19_19_512,Default,0.00986368
GemmTunableOp_float_TN,tn_2048_1500_11_ld_11_11_2048,Default,0.0438419
GemmTunableOp_float_TN,tn_512_1500_11_ld_11_11_512,Default,0.0108538
GemmTunableOp_float_NN,nn_2048_1500_1_ld_1_1_2048,Default,0.0448797
GemmTunableOp_float_TN,tn_2048_1500_39_ld_39_39_2048,Default,0.0386016
GemmTunableOp_float_TN,tn_183286_1500_2048_ld_2048_2048_183286,Default,55.3769
GemmTunableOp_float_NN,nn_2048_1500_183286_ld_2048_183286_2048,Default,45.8383
GemmTunableOp_float_NN,nn_8192_1500_2048_ld_8192_2048_8192,Default,2.15098
GemmTunableOp_float_NN,nn_2048_1500_8192_ld_2048_8192_2048,Default,2.07536
GemmTunableOp_float_NT,nt_32_2048_1500_ld_32_2048_32,Default,0.0261971
GemmTunableOp_float_NN,nn_32_1500_2048_ld_32_2048_32,Default,0.0341888
GemmTunableOp_float_NT,nt_2048_32_1500_ld_2048_32_2048,Default,0.0308774
GemmTunableOp_float_NN,nn_2048_1500_32_ld_2048_32_2048,Default,0.0218438
GemmTunableOp_float_NN,nn_2048_1500_2048_ld_2048_2048_2048,Default,0.526849
GemmTunableOp_float_NT,nt_32_512_1500_ld_32_512_32,Default,0.0117091
GemmTunableOp_float_NN,nn_32_1500_512_ld_32_512_32,Default,0.0158723
GemmTunableOp_float_NN,nn_2048_1500_512_ld_2048_512_2048,Default,0.155777
GemmTunableOp_float_TN,tn_2048_1500_14_ld_14_14_2048,Default,0.0461594
GemmTunableOp_float_TN,tn_512_1500_14_ld_14_14_512,Default,0.00966048
GemmTunableOp_float_TN,tn_2048_1500_10_ld_10_10_2048,Default,0.0466816
GemmTunableOp_float_TN,tn_512_1500_10_ld_10_10_512,Default,0.0111062
GemmTunableOp_float_TN,tn_2048_1500_13_ld_13_13_2048,Default,0.046255
GemmTunableOp_float_TN,tn_2048_1500_9_ld_9_9_2048,Default,0.0451904
GemmTunableOp_float_TN,tn_512_1500_9_ld_9_9_512,Default,0.0143616
GemmTunableOp_float_TN,tn_2048_1500_42_ld_42_42_2048,Default,0.0313322
GemmTunableOp_float_TN,tn_2048_1500_18_ld_18_18_2048,Default,0.0469293
GemmTunableOp_float_TN,tn_512_1500_18_ld_18_18_512,Default,0.0109062
GemmTunableOp_float_TN,tn_2048_1500_16_ld_16_16_2048,Default,0.043408
GemmTunableOp_float_TN,tn_512_1500_16_ld_16_16_512,Default,0.0110848
GemmTunableOp_float_TN,tn_2048_1500_44_ld_44_44_2048,Default,0.0338032
GemmTunableOp_float_TN,tn_2048_1500_40_ld_40_40_2048,Default,0.0289824
GemmTunableOp_float_TN,tn_2048_1500_45_ld_45_45_2048,Default,0.0379392
GemmTunableOp_float_TN,tn_2048_1500_41_ld_41_41_2048,Default,0.0314986
GemmTunableOp_float_TN,tn_2048_1500_15_ld_15_15_2048,Default,0.046329
GemmTunableOp_float_TN,tn_512_1500_15_ld_15_15_512,Default,0.0117795
GemmTunableOp_float_TN,tn_512_1500_13_ld_13_13_512,Default,0.0109171
GemmTunableOp_float_TN,tn_2048_1500_21_ld_21_21_2048,Default,0.0211488
GemmTunableOp_float_TN,tn_512_1500_21_ld_21_21_512,Default,0.00914816
GemmTunableOp_float_TN,tn_2048_1500_46_ld_46_46_2048,Default,0.0333229
GemmTunableOp_float_TN,tn_2048_1500_43_ld_43_43_2048,Default,0.0333741
GemmTunableOp_float_TN,tn_2048_1500_52_ld_52_52_2048,Default,0.0356525
GemmTunableOp_float_TN,tn_2048_1500_22_ld_22_22_2048,Default,0.022449
GemmTunableOp_float_TN,tn_512_1500_22_ld_22_22_512,Default,0.00930304
GemmTunableOp_float_TN,tn_512_1500_6_ld_6_6_512,Default,0.0134784
GemmTunableOp_float_TN,tn_2048_1500_48_ld_48_48_2048,Default,0.0354966
GemmTunableOp_float_NN,nn_512_1500_1_ld_1_1_512,Default,0.0124026
GemmTunableOp_float_TN,tn_2048_1500_47_ld_47_47_2048,Default,0.0353392
GemmTunableOp_float_TN,tn_2048_1500_58_ld_58_58_2048,Default,0.0392595
GemmTunableOp_float_TN,tn_2048_1500_55_ld_55_55_2048,Default,0.0374291
GemmTunableOp_float_TN,tn_2048_1500_23_ld_23_23_2048,Default,0.0230784
GemmTunableOp_float_TN,tn_512_1500_23_ld_23_23_512,Default,0.011271
GemmTunableOp_float_TN,tn_2048_1500_51_ld_51_51_2048,Default,0.0425075
GemmTunableOp_float_TN,tn_2048_1500_50_ld_50_50_2048,Default,0.0416675
GemmTunableOp_float_TN,tn_2048_1500_53_ld_53_53_2048,Default,0.0373142
GemmTunableOp_float_TN,tn_2048_1500_49_ld_49_49_2048,Default,0.0375542
GemmTunableOp_float_TN,tn_2048_1500_64_ld_64_64_2048,Default,0.0354486
GemmTunableOp_float_TN,tn_2048_1500_54_ld_54_54_2048,Default,0.037624
GemmStridedBatchedTunableOp_float_TN,tn_1500_1500_64_B_32_ld_64_2048_1500,Default,0.8332
GemmStridedBatchedTunableOp_float_NN,nn_64_1500_1500_B_32_ld_64_1500_64,Default,0.733918
GemmStridedBatchedTunableOp_float_NT,nt_64_1500_1500_B_32_ld_2048_1500_64,Default,0.541623
GemmStridedBatchedTunableOp_float_NT,nt_1500_64_1500_B_32_ld_1500_2048_1500,Default,0.687999
GemmTunableOp_float_TN,tn_2048_1500_37_ld_37_37_2048,Default,0.0350186
GemmTunableOp_float_TN,tn_2048_1500_38_ld_38_38_2048,Default,0.0381661
GemmTunableOp_float_TN,tn_2048_1500_57_ld_57_57_2048,Default,0.0395312
GemmTunableOp_float_TN,tn_2048_1500_62_ld_62_62_2048,Default,0.0404496
GemmTunableOp_float_TN,tn_2048_1500_68_ld_68_68_2048,Default,0.0531395
GemmTunableOp_float_TN,tn_2048_1500_60_ld_60_60_2048,Default,0.0384781
GemmTunableOp_float_TN,tn_2048_1500_59_ld_59_59_2048,Default,0.0392605
GemmTunableOp_float_TN,tn_2048_1500_56_ld_56_56_2048,Default,0.0358806
GemmTunableOp_float_TN,tn_2048_1500_25_ld_25_25_2048,Default,0.0231978
GemmTunableOp_float_TN,tn_512_1500_25_ld_25_25_512,Default,0.011335
GemmTunableOp_float_TN,tn_2048_1500_67_ld_67_67_2048,Default,0.0518541
GemmTunableOp_float_TN,tn_2048_1500_70_ld_70_70_2048,Default,0.0546768
GemmTunableOp_float_TN,tn_2048_1500_24_ld_24_24_2048,Default,0.0209712
GemmTunableOp_float_TN,tn_512_1500_24_ld_24_24_512,Default,0.00935008
GemmTunableOp_float_TN,tn_2048_1500_61_ld_61_61_2048,Default,0.0416614
GemmTunableOp_float_TN,tn_2048_1500_69_ld_69_69_2048,Default,0.0563478
GemmTunableOp_float_TN,tn_2048_1500_85_ld_85_85_2048,Default,0.0538749
GemmTunableOp_float_TN,tn_2048_1500_63_ld_63_63_2048,Default,0.0388368
GemmTunableOp_float_TN,tn_2048_1500_76_ld_76_76_2048,Default,0.0497053
GemmTunableOp_float_TN,tn_2048_1500_72_ld_72_72_2048,Default,0.0458419
GemmTunableOp_float_TN,tn_2048_1500_66_ld_66_66_2048,Default,0.0482534
GemmTunableOp_float_TN,tn_2048_1500_83_ld_83_83_2048,Default,0.0579302
GemmTunableOp_float_TN,tn_2048_1500_92_ld_92_92_2048,Default,0.052521
GemmTunableOp_float_TN,tn_2048_1500_71_ld_71_71_2048,Default,0.0571242
GemmTunableOp_float_TN,tn_2048_1500_65_ld_65_65_2048,Default,0.0474538
GemmTunableOp_float_TN,tn_2048_1500_75_ld_75_75_2048,Default,0.0502698
GemmTunableOp_float_TN,tn_2048_1500_93_ld_93_93_2048,Default,0.0527341
GemmTunableOp_float_TN,tn_2048_1500_89_ld_89_89_2048,Default,0.0525005
GemmTunableOp_float_TN,tn_2048_1500_100_ld_100_100_2048,Default,0.0578589
GemmTunableOp_float_TN,tn_2048_1500_26_ld_26_26_2048,Default,0.0244883
GemmTunableOp_float_TN,tn_512_1500_26_ld_26_26_512,Default,0.00980512
GemmTunableOp_float_TN,tn_2048_1500_81_ld_81_81_2048,Default,0.0549942
GemmTunableOp_float_TN,tn_2048_1500_97_ld_97_97_2048,Default,0.0591178
GemmTunableOp_float_TN,tn_2048_1500_73_ld_73_73_2048,Default,0.047385
GemmTunableOp_float_TN,tn_2048_1500_98_ld_98_98_2048,Default,0.05812
GemmTunableOp_float_TN,tn_2048_1500_104_ld_104_104_2048,Default,0.0567046
GemmTunableOp_float_TN,tn_2048_1500_80_ld_80_80_2048,Default,0.0513798
GemmTunableOp_float_TN,tn_2048_1500_86_ld_86_86_2048,Default,0.0557181
GemmTunableOp_float_TN,tn_2048_1500_74_ld_74_74_2048,Default,0.0483901
GemmTunableOp_float_TN,tn_2048_1500_119_ld_119_119_2048,Default,0.0634768
GemmTunableOp_float_TN,tn_2048_1500_27_ld_27_27_2048,Default,0.0249437
GemmTunableOp_float_TN,tn_2048_1500_118_ld_118_118_2048,Default,0.063233
GemmTunableOp_float_TN,tn_2048_1500_113_ld_113_113_2048,Default,0.0629645
GemmTunableOp_float_TN,tn_2048_1500_91_ld_91_91_2048,Default,0.0527229
GemmTunableOp_float_TN,tn_2048_1500_84_ld_84_84_2048,Default,0.0520026
GemmTunableOp_float_TN,tn_2048_1500_79_ld_79_79_2048,Default,0.0515818
GemmTunableOp_float_TN,tn_2048_1500_102_ld_102_102_2048,Default,0.0582928
GemmTunableOp_float_TN,tn_2048_1500_105_ld_105_105_2048,Default,0.0583168
GemmTunableOp_float_TN,tn_2048_1500_90_ld_90_90_2048,Default,0.0524352
GemmTunableOp_float_TN,tn_2048_1500_78_ld_78_78_2048,Default,0.0510077
GemmTunableOp_float_TN,tn_2048_1500_29_ld_29_29_2048,Default,0.0263731
GemmTunableOp_float_TN,tn_2048_1500_107_ld_107_107_2048,Default,0.0585056
GemmTunableOp_float_TN,tn_2048_1500_116_ld_116_116_2048,Default,0.062784
GemmTunableOp_float_TN,tn_512_1500_27_ld_27_27_512,Default,0.0106586
GemmTunableOp_float_TN,tn_2048_1500_122_ld_122_122_2048,Default,0.0632688
GemmTunableOp_float_TN,tn_2048_1500_28_ld_28_28_2048,Default,0.0258746
GemmTunableOp_float_TN,tn_2048_1500_112_ld_112_112_2048,Default,0.0557661
GemmTunableOp_float_TN,tn_2048_1500_109_ld_109_109_2048,Default,0.0599254
GemmTunableOp_float_TN,tn_2048_1500_121_ld_121_121_2048,Default,0.063064
GemmTunableOp_float_TN,tn_2048_1500_110_ld_110_110_2048,Default,0.0585926
GemmTunableOp_float_TN,tn_2048_1500_120_ld_120_120_2048,Default,0.0618762
GemmTunableOp_float_TN,tn_2048_1500_99_ld_99_99_2048,Default,0.0586595
GemmTunableOp_float_TN,tn_2048_1500_125_ld_125_125_2048,Default,0.0630806
GemmTunableOp_float_TN,tn_2048_1500_96_ld_96_96_2048,Default,0.0505542
GemmTunableOp_float_TN,tn_2048_1500_108_ld_108_108_2048,Default,0.0581773
GemmTunableOp_float_TN,tn_2048_1500_77_ld_77_77_2048,Default,0.0516307
GemmTunableOp_float_TN,tn_2048_1500_87_ld_87_87_2048,Default,0.0561642
GemmTunableOp_float_NN,nn_102_32_1_ld_102_1_102,Default,0.00650304
GemmTunableOp_float_TN,tn_32_102_2048_ld_2048_2048_32,Default,0.0113862
GemmTunableOp_float_TN,tn_2048_102_32_ld_32_32_2048,Default,0.00731552
GemmTunableOp_float_TN,tn_512_102_32_ld_32_32_512,Default,0.00914944
GemmTunableOp_BFloat16_TN,tn_2048_102_4_ld_4_4_2048,Default,0.00683936
GemmTunableOp_BFloat16_TN,tn_8192_102_3_ld_3_3_8192,Default,0.0078112
GemmTunableOp_BFloat16_TN,tn_2048_102_5_ld_5_5_2048,Default,0.00670176
GemmTunableOp_BFloat16_TN,tn_8192_102_5_ld_5_5_8192,Default,0.0094656
GemmTunableOp_BFloat16_TN,tn_2048_102_2_ld_2_2_2048,Default,0.00706944
GemmTunableOp_BFloat16_TN,tn_512_102_2_ld_2_2_512,Default,0.0084704
GemmTunableOp_BFloat16_TN,tn_2048_102_3_ld_3_3_2048,Default,0.00679296
GemmTunableOp_BFloat16_TN,tn_512_102_3_ld_3_3_512,Default,0.00850144
GemmTunableOp_BFloat16_TN,tn_512_102_4_ld_4_4_512,Default,0.00645216
GemmTunableOp_BFloat16_TN,tn_8192_102_4_ld_4_4_8192,Default,0.00794016
GemmTunableOp_BFloat16_TN,tn_512_102_5_ld_5_5_512,Default,0.00665504
GemmTunableOp_BFloat16_NN,nn_2048_102_1_ld_1_1_2048,Default,0.00642272
GemmTunableOp_BFloat16_TN,tn_2048_102_9_ld_9_9_2048,Default,0.00834688
GemmTunableOp_BFloat16_TN,tn_512_102_9_ld_9_9_512,Default,0.0066816
GemmTunableOp_BFloat16_TN,tn_2048_102_6_ld_6_6_2048,Default,0.00678944
GemmTunableOp_BFloat16_TN,tn_512_102_6_ld_6_6_512,Default,0.00700224
GemmTunableOp_BFloat16_TN,tn_2048_102_7_ld_7_7_2048,Default,0.00693216
GemmTunableOp_BFloat16_TN,tn_2048_102_37_ld_37_37_2048,Default,0.00674432
GemmTunableOp_float_NN,nn_119_32_1_ld_119_1_119,Default,0.00637984
GemmTunableOp_float_TN,tn_32_119_2048_ld_2048_2048_32,Default,0.012175
GemmTunableOp_float_TN,tn_2048_119_32_ld_32_32_2048,Default,0.00732064
GemmTunableOp_float_TN,tn_512_119_32_ld_32_32_512,Default,0.0085312
GemmTunableOp_BFloat16_TN,tn_2048_119_4_ld_4_4_2048,Default,0.0090416
GemmTunableOp_BFloat16_TN,tn_8192_119_3_ld_3_3_8192,Default,0.00875616
GemmTunableOp_BFloat16_TN,tn_2048_119_5_ld_5_5_2048,Default,0.00680864
GemmTunableOp_BFloat16_TN,tn_8192_119_5_ld_5_5_8192,Default,0.0100218
GemmTunableOp_BFloat16_TN,tn_2048_119_2_ld_2_2_2048,Default,0.00879264
GemmTunableOp_BFloat16_TN,tn_512_119_2_ld_2_2_512,Default,0.00614784
GemmTunableOp_BFloat16_TN,tn_2048_119_3_ld_3_3_2048,Default,0.0065952
GemmTunableOp_BFloat16_TN,tn_512_119_3_ld_3_3_512,Default,0.00689536
GemmTunableOp_BFloat16_TN,tn_512_119_5_ld_5_5_512,Default,0.00674336
GemmTunableOp_BFloat16_TN,tn_512_119_4_ld_4_4_512,Default,0.00634912
GemmTunableOp_BFloat16_TN,tn_8192_119_4_ld_4_4_8192,Default,0.00859488
GemmTunableOp_BFloat16_NN,nn_2048_119_1_ld_1_1_2048,Default,0.00599296
GemmTunableOp_BFloat16_TN,tn_2048_119_10_ld_10_10_2048,Default,0.0085232
GemmTunableOp_BFloat16_TN,tn_512_119_10_ld_10_10_512,Default,0.00817536
GemmTunableOp_BFloat16_TN,tn_2048_119_7_ld_7_7_2048,Default,0.00652032
GemmTunableOp_BFloat16_TN,tn_512_119_7_ld_7_7_512,Default,0.00788672
GemmTunableOp_BFloat16_TN,tn_2048_119_6_ld_6_6_2048,Default,0.00960032
GemmTunableOp_BFloat16_TN,tn_512_119_6_ld_6_6_512,Default,0.00621472
GemmTunableOp_BFloat16_TN,tn_2048_119_9_ld_9_9_2048,Default,0.00701088
GemmTunableOp_BFloat16_TN,tn_512_119_9_ld_9_9_512,Default,0.00588032
GemmTunableOp_BFloat16_TN,tn_2048_119_38_ld_38_38_2048,Default,0.00605216
GemmTunableOp_float_NN,nn_124_32_1_ld_124_1_124,Default,0.00610816
GemmTunableOp_float_TN,tn_32_124_2048_ld_2048_2048_32,Default,0.0115475
GemmTunableOp_float_TN,tn_2048_124_32_ld_32_32_2048,Default,0.00767936
GemmTunableOp_float_TN,tn_512_124_32_ld_32_32_512,Default,0.00884384
GemmTunableOp_BFloat16_TN,tn_2048_124_4_ld_4_4_2048,Default,0.00654784
GemmTunableOp_BFloat16_TN,tn_8192_124_3_ld_3_3_8192,Default,0.0128682
GemmTunableOp_BFloat16_TN,tn_2048_124_5_ld_5_5_2048,Default,0.00650624
GemmTunableOp_BFloat16_TN,tn_8192_124_5_ld_5_5_8192,Default,0.00916384
GemmTunableOp_BFloat16_TN,tn_2048_124_2_ld_2_2_2048,Default,0.00834496
GemmTunableOp_BFloat16_TN,tn_512_124_2_ld_2_2_512,Default,0.00663712
GemmTunableOp_BFloat16_TN,tn_2048_124_3_ld_3_3_2048,Default,0.00666784
GemmTunableOp_BFloat16_TN,tn_512_124_3_ld_3_3_512,Default,0.00625984
GemmTunableOp_BFloat16_TN,tn_512_124_5_ld_5_5_512,Default,0.00668704
GemmTunableOp_BFloat16_TN,tn_512_124_4_ld_4_4_512,Default,0.0086832
GemmTunableOp_BFloat16_TN,tn_8192_124_4_ld_4_4_8192,Default,0.00890848
GemmTunableOp_BFloat16_TN,tn_2048_124_6_ld_6_6_2048,Default,0.00741216
GemmTunableOp_BFloat16_TN,tn_512_124_6_ld_6_6_512,Default,0.0069264
GemmTunableOp_BFloat16_NN,nn_2048_124_1_ld_1_1_2048,Default,0.00640352
GemmTunableOp_BFloat16_TN,tn_2048_124_12_ld_12_12_2048,Default,0.008864
GemmTunableOp_BFloat16_TN,tn_512_124_12_ld_12_12_512,Default,0.00867904
GemmTunableOp_BFloat16_TN,tn_2048_124_8_ld_8_8_2048,Default,0.0121523
GemmTunableOp_BFloat16_TN,tn_512_124_8_ld_8_8_512,Default,0.00873568
GemmTunableOp_BFloat16_TN,tn_2048_124_7_ld_7_7_2048,Default,0.0068576
GemmTunableOp_BFloat16_TN,tn_512_124_7_ld_7_7_512,Default,0.00681664
GemmTunableOp_BFloat16_TN,tn_2048_124_41_ld_41_41_2048,Default,0.0066928
